{
 "schema": "csf-p1-handoff/1",
 "engagement": {
  "client": "Sample: Siam Precision Parts (fictional)",
  "alias": "Client B",
  "reference": "SAMPLE-002",
  "assessor": "Sample Assessor, Senior Consultant",
  "assessmentDate": "2026-09-14",
  "cutoff": "2026-10-02",
  "scope": "One plant and head office, ERP, file server, Microsoft 365. Fictional example data.",
  "scale": "S",
  "industry": "mfg",
  "packOptions": [],
  "flags": {
   "cii": false,
   "pdpa": true,
   "cca": true,
   "iso": false,
   "cloud": true,
   "mssp": false,
   "ai": false,
   "dev": false
  },
  "ot": false,
  "employees": "160",
  "systemsInScope": "9",
  "sites": "1",
  "appVersion": "2.0.0",
  "rubricVersion": "1.2",
  "stateSchema": "csf-ig/4",
  "questionSetHash": "37cced1a",
  "exported": "2026-10-25T11:03:08.740Z",
  "sourceHash": "1ba200bd",
  "aliased": false
 },
 "subcategories": [
  {
   "id": "GV.OC-01",
   "function": "GV",
   "category": "GV.OC",
   "session": "S1",
   "statedTier": "1",
   "countedTier": 1,
   "evidenceLevel": "S",
   "evidenceIds": [],
   "flags": {
    "capped": false,
    "coverageCapped": false,
    "evidenceLinkMissing": false,
    "noCurrentCycleRecord": false
   },
   "coverage": {
    "applicable": false,
    "band": "",
    "pct": null
   },
   "statements": [],
   "conflict": "",
   "mandates": [],
   "references": [],
   "ratingPath": "drill",
   "answeredBy": [
    "Sample Managing Director"
   ],
   "notes": "Sample: interviewee described the current practice with one example.",
   "gap": "Sample: practice depends on the IT Manager and is not written down or approved."
  },
  {
   "id": "GV.OC-02",
   "function": "GV",
   "category": "GV.OC",
   "session": "S1",
   "statedTier": "1",
   "countedTier": 1,
   "evidenceLevel": "S",
   "evidenceIds": [],
   "flags": {
    "capped": false,
    "coverageCapped": false,
    "evidenceLinkMissing": false,
    "noCurrentCycleRecord": false
   },
   "coverage": {
    "applicable": false,
    "band": "",
    "pct": null
   },
   "statements": [],
   "conflict": "",
   "mandates": [],
   "references": [],
   "ratingPath": "drill",
   "answeredBy": [
    "Sample Managing Director"
   ],
   "notes": "Sample: interviewee described the current practice with one example.",
   "gap": "Sample: practice depends on the IT Manager and is not written down or approved."
  },
  {
   "id": "GV.OC-03",
   "function": "GV",
   "category": "GV.OC",
   "session": "S4",
   "statedTier": "2",
   "countedTier": 2,
   "evidenceLevel": "D",
   "evidenceIds": [
    "EV-SA-001"
   ],
   "flags": {
    "capped": false,
    "coverageCapped": false,
    "evidenceLinkMissing": false,
    "noCurrentCycleRecord": false
   },
   "coverage": {
    "applicable": false,
    "band": "",
    "pct": null
   },
   "statements": [],
   "conflict": "",
   "mandates": [],
   "references": [],
   "ratingPath": "drill",
   "answeredBy": [
    "Sample Managing Director"
   ],
   "notes": "Sample: interviewee described the current practice with one example.",
   "gap": "Sample: practice depends on the IT Manager and is not written down or approved."
  },
  {
   "id": "GV.OC-04",
   "function": "GV",
   "category": "GV.OC",
   "session": "S1",
   "statedTier": "1",
   "countedTier": 1,
   "evidenceLevel": "S",
   "evidenceIds": [],
   "flags": {
    "capped": false,
    "coverageCapped": false,
    "evidenceLinkMissing": false,
    "noCurrentCycleRecord": false
   },
   "coverage": {
    "applicable": false,
    "band": "",
    "pct": null
   },
   "statements": [],
   "conflict": "",
   "mandates": [],
   "references": [],
   "ratingPath": "drill",
   "answeredBy": [
    "Sample Managing Director"
   ],
   "notes": "Sample: interviewee described the current practice with one example.",
   "gap": "Sample: practice depends on the IT Manager and is not written down or approved."
  },
  {
   "id": "GV.OC-05",
   "function": "GV",
   "category": "GV.OC",
   "session": "S1",
   "statedTier": "1",
   "countedTier": 1,
   "evidenceLevel": "S",
   "evidenceIds": [],
   "flags": {
    "capped": false,
    "coverageCapped": false,
    "evidenceLinkMissing": false,
    "noCurrentCycleRecord": false
   },
   "coverage": {
    "applicable": false,
    "band": "",
    "pct": null
   },
   "statements": [],
   "conflict": "",
   "mandates": [],
   "references": [],
   "ratingPath": "drill",
   "answeredBy": [
    "Sample Purchasing Supervisor"
   ],
   "notes": "Sample: interviewee described the current practice with one example.",
   "gap": "Sample: practice depends on the IT Manager and is not written down or approved."
  },
  {
   "id": "GV.RM-01",
   "function": "GV",
   "category": "GV.RM",
   "session": "S1",
   "statedTier": "1",
   "countedTier": 1,
   "evidenceLevel": "S",
   "evidenceIds": [],
   "flags": {
    "capped": false,
    "coverageCapped": false,
    "evidenceLinkMissing": false,
    "noCurrentCycleRecord": false
   },
   "coverage": {
    "applicable": false,
    "band": "",
    "pct": null
   },
   "statements": [],
   "conflict": "",
   "mandates": [],
   "references": [],
   "ratingPath": "drill",
   "answeredBy": [
    "Sample Managing Director"
   ],
   "notes": "Sample: interviewee described the current practice with one example.",
   "gap": "Sample: practice depends on the IT Manager and is not written down or approved."
  },
  {
   "id": "GV.RM-02",
   "function": "GV",
   "category": "GV.RM",
   "session": "S1",
   "statedTier": "1",
   "countedTier": 1,
   "evidenceLevel": "S",
   "evidenceIds": [],
   "flags": {
    "capped": false,
    "coverageCapped": false,
    "evidenceLinkMissing": false,
    "noCurrentCycleRecord": false
   },
   "coverage": {
    "applicable": false,
    "band": "",
    "pct": null
   },
   "statements": [],
   "conflict": "",
   "mandates": [],
   "references": [],
   "ratingPath": "drill",
   "answeredBy": [
    "Sample Managing Director"
   ],
   "notes": "Sample: interviewee described the current practice with one example.",
   "gap": "Sample: practice depends on the IT Manager and is not written down or approved."
  },
  {
   "id": "GV.RM-03",
   "function": "GV",
   "category": "GV.RM",
   "session": "S3",
   "statedTier": "1",
   "countedTier": 1,
   "evidenceLevel": "S",
   "evidenceIds": [],
   "flags": {
    "capped": false,
    "coverageCapped": false,
    "evidenceLinkMissing": false,
    "noCurrentCycleRecord": false
   },
   "coverage": {
    "applicable": false,
    "band": "",
    "pct": null
   },
   "statements": [],
   "conflict": "",
   "mandates": [],
   "references": [],
   "ratingPath": "drill",
   "answeredBy": [
    "Sample Managing Director"
   ],
   "notes": "Sample: interviewee described the current practice with one example.",
   "gap": "Sample: practice depends on the IT Manager and is not written down or approved."
  },
  {
   "id": "GV.RM-04",
   "function": "GV",
   "category": "GV.RM",
   "session": "S1",
   "statedTier": "1",
   "countedTier": 1,
   "evidenceLevel": "S",
   "evidenceIds": [],
   "flags": {
    "capped": false,
    "coverageCapped": false,
    "evidenceLinkMissing": false,
    "noCurrentCycleRecord": false
   },
   "coverage": {
    "applicable": false,
    "band": "",
    "pct": null
   },
   "statements": [],
   "conflict": "",
   "mandates": [],
   "references": [],
   "ratingPath": "drill",
   "answeredBy": [
    "Sample Managing Director"
   ],
   "notes": "Sample: interviewee described the current practice with one example.",
   "gap": "Sample: practice depends on the IT Manager and is not written down or approved."
  },
  {
   "id": "GV.RM-05",
   "function": "GV",
   "category": "GV.RM",
   "session": "S3",
   "statedTier": "1",
   "countedTier": 1,
   "evidenceLevel": "S",
   "evidenceIds": [],
   "flags": {
    "capped": false,
    "coverageCapped": false,
    "evidenceLinkMissing": false,
    "noCurrentCycleRecord": false
   },
   "coverage": {
    "applicable": false,
    "band": "",
    "pct": null
   },
   "statements": [],
   "conflict": "",
   "mandates": [],
   "references": [],
   "ratingPath": "drill",
   "answeredBy": [
    "Sample Purchasing Supervisor"
   ],
   "notes": "Sample: interviewee described the current practice with one example.",
   "gap": "Sample: practice depends on the IT Manager and is not written down or approved."
  },
  {
   "id": "GV.RM-06",
   "function": "GV",
   "category": "GV.RM",
   "session": "S3",
   "statedTier": "1",
   "countedTier": 1,
   "evidenceLevel": "S",
   "evidenceIds": [],
   "flags": {
    "capped": false,
    "coverageCapped": false,
    "evidenceLinkMissing": false,
    "noCurrentCycleRecord": false
   },
   "coverage": {
    "applicable": false,
    "band": "",
    "pct": null
   },
   "statements": [],
   "conflict": "",
   "mandates": [],
   "references": [],
   "ratingPath": "drill",
   "answeredBy": [
    "Sample Managing Director"
   ],
   "notes": "Sample: interviewee described the current practice with one example.",
   "gap": "Sample: practice depends on the IT Manager and is not written down or approved."
  },
  {
   "id": "GV.RM-07",
   "function": "GV",
   "category": "GV.RM",
   "session": "S1",
   "statedTier": "1",
   "countedTier": 1,
   "evidenceLevel": "S",
   "evidenceIds": [],
   "flags": {
    "capped": false,
    "coverageCapped": false,
    "evidenceLinkMissing": false,
    "noCurrentCycleRecord": false
   },
   "coverage": {
    "applicable": false,
    "band": "",
    "pct": null
   },
   "statements": [],
   "conflict": "",
   "mandates": [],
   "references": [],
   "ratingPath": "drill",
   "answeredBy": [
    "Sample Managing Director"
   ],
   "notes": "Sample: interviewee described the current practice with one example.",
   "gap": "Sample: practice depends on the IT Manager and is not written down or approved."
  },
  {
   "id": "GV.RR-01",
   "function": "GV",
   "category": "GV.RR",
   "session": "S1",
   "statedTier": "1",
   "countedTier": 1,
   "evidenceLevel": "S",
   "evidenceIds": [],
   "flags": {